img_name,xmin,ymin,xmax,ymax,class_confidence,class,class_tmp,attribute,attribute_refine
00070007_0964.jpg,0.9997,1.0001,177.9999,117.00002,1,building,building_1.00,"large, white, pink, purple, glass, big",large
00070007_0964.jpg,22.999925,55.999906,181.999675,145.999854,1,bush,bush_23.00,"green, colorful, purple, multi colored, large, white",green
00070007_0964.jpg,0.9997,133.999968,650,292,1,water,water_1.00,"wet, calm, gray, large, brown, clear","wet, brown"
00070007_0964.jpg,239.999825,19.999956,532.999675,141.999892,1,building,building_240.00,"white, blue, silver, red, glass, green",white
00070007_0964.jpg,520.9997,95.999964,650,138.000076,1,building,building_521.00,"red, yellow, brown, pink, white, long",pink
